{
  "dataset_id": "telecom-context-eval-synthetic",
  "version": "0.1.0",
  "status": "DRAFT",
  "created_at": "2026-09-01T00:00:00+08:00",
  "source_snapshot_id": "synthetic-snapshot-v1",
  "description": "不包含真实业务信息的评测契约示例",
  "security_classification": "SYNTHETIC",
  "authority_policy": [
    {
      "rank": 1,
      "source_type": "metric_definition",
      "description": "已发布指标定义优先"
    },
    {
      "rank": 2,
      "source_type": "data_dictionary",
      "description": "已发布数据字典提供模型、表和字段事实"
    },
    {
      "rank": 3,
      "source_type": "model_design",
      "description": "已评审模型设计提供目标结构和加工规则"
    }
  ],
  "files": {
    "evidence": "evidence.jsonl",
    "cases": "cases.jsonl",
    "design_oracles": "design-oracles.jsonl"
  },
  "created_by": ["synthetic-author"],
  "approved_by": [],
  "notes": "仅用于验证工具链"
}
